{"run":27,"commit":"325eb39","metric":5779629.042,"metrics":{"feed_ns":4546460.738,"wire_ns":1233168.304,"wall_s":86.5},"status":"discard","description":"Gate per-cell styling checks with Ghostty's row-level styled flag","timestamp":1786353219341,"segment":0,"confidence":7.984062439739561,"asi":{"hypothesis":"Pay two row-level FFI queries to skip has_styling for every cell in wholly plain rows while preserving styled-row behavior","rollback_reason":"With host timing stabilized, aggregate was 1.8% worse than run 22; row-level queries and false-positive paths cost more across the broad workload than plain-row cell queries saved","next_action_hint":"Do not retry row styling gating; pursue batched multi-get FFI if reducing accessor count becomes worth a dependency change"}}
